{
  "$schema": "https://json-schema.org/draft/2020-12/schema",
  "$id": "https://devshelf.ritualdev.in/schemas/contributor.schema.json",
  "title": "DevShelf Contributors Wanted Project",
  "description": "Schema for open-source repositories welcoming contributors",
  "type": "array",
  "items": {
    "type": "object",
    "required": [
      "name",
      "repo",
      "category",
      "description",
      "seeking",
      "goodFirstIssues",
      "language"
    ],
    "properties": {
      "name": {
        "type": "string",
        "minLength": 2,
        "description": "Name of the open source project"
      },
      "repo": {
        "type": "string",
        "format": "uri",
        "pattern": "^https?://",
        "description": "GitHub repository URL"
      },
      "category": {
        "type": "string",
        "description": "Functional domain of the project"
      },
      "description": {
        "type": "string",
        "minLength": 10,
        "maxLength": 300,
        "description": "Description of the repository's mission"
      },
      "seeking": {
        "type": "string",
        "description": "Specific areas where contributions or help are needed"
      },
      "goodFirstIssues": {
        "type": "string",
        "format": "uri",
        "pattern": "^https?://",
        "description": "Direct URL to good-first-issues or beginner contributor issues"
      },
      "language": {
        "type": "string",
        "description": "Primary programming language"
      },
      "featured": {
        "type": "boolean",
        "description": "Whether this tool is highlighted in weekly spotlights"
      },
      "sponsorTier": {
        "type": "string",
        "description": "Optional verified sponsor tier metadata"
      },
      "statusTags": {
        "type": "array",
        "items": { "type": "string" },
        "description": "Optional telemetry status tags"
      },
      "lastCheckedAt": {
        "type": "string",
        "description": "ISO timestamp of most recent HTTP endpoint reachability check"
      },
      "lastVerifiedAt": {
        "type": "string",
        "description": "ISO timestamp when entry existence was verified by maintainer or automated pipeline"
      },
      "pricingVerifiedAt": {
        "type": "string",
        "description": "ISO timestamp when zero-paywall pricing terms and free tier were verified"
      },
      "healthStatus": {
        "type": "string",
        "enum": ["healthy", "degraded", "down", "redirected", "bot_challenge", "unknown"],
        "description": "Live endpoint operational status"
      },
      "authRequirements": {
        "type": "string",
        "description": "Detailed authentication requirement (e.g. none, free api key, oauth, registration)"
      },
      "freeTierLimits": {
        "type": "string",
        "description": "Specific free tier limits or perpetual zero-cost quotas"
      },
      "verifiedZeroPaywall": {
        "type": "boolean",
        "description": "Whether the resource is verified to have an authentic, permanent zero-paywall tier"
      },
      "redirectUrl": {
        "type": "string",
        "format": "uri",
        "pattern": "^https?://",
        "description": "Tracked redirect target URL if destination moved"
      }
    },
    "additionalProperties": false
  }
}
